{
  "version": 1,
  "name": "mycb2",
  "commonName": "Test mycb2",
  "macroId": "mycb2",
  "description": "CBXPPATH test fixture",
  "type": "control-block",
  "aliases": [],
  "pointedToBy": [],
  "storageAttributes": {
    "subpools": [],
    "key": 0,
    "residency": 31
  },
  "sections": [
    {
      "name": "mycb2",
      "fields": [
        {
          "name": "MYCBID",
          "offset": 0,
          "length": 4,
          "type": "string",
          "init": [
            {
              "type": "string",
              "value": "MYCB"
            }
          ],
          "eyecatcher": true
        },
        {
          "name": "MYCBNUM",
          "offset": 4,
          "length": 4,
          "type": "unsigned-integer"
        }
      ]
    }
  ]
}
